{
  "$schema": "../schema/prompt.schema.json",
  "id": "memory-drawers",
  "title": "Размеры типов данных",
  "summary": "Байты на значение как комод: каждый ящик выдвинут на столько, сколько байт занимает тип.",
  "format": "svg",
  "size": "figure",
  "category": "Основы",
  "tags": [
    "память",
    "типы",
    "байты",
    "статья"
  ],
  "animated": false,
  "prompt": "/anatomy Сделай фигуру размера Figure, которая объясняет сколько памяти занимает одно значение разных типов данных.\n\nОбъект: аптекарский комод из семи ящиков на ножках, ящики выдвинуты на глубину, пропорциональную числу байт; в каждом ящике видны ячейки-байты.\nЧто движется и что это значит: в кадре все ящики выдвинуты: глубина ящика = размер типа. Сравнение читается по ступенькам торцов.\nРеальные числа (readout, движение и подпись считаются из одной модели): {types}; один байт = одна ячейка глубины ящика.\nДетали (40–80 штук): корпус комода с карнизом и цоколем, ножки, ящики с передними панелями и латунными ручками, рамки для этикеток, направляющие, ячейки внутри ящиков, линейка с рисками сбоку, винты на петлях. Самый глубокий ящик — деталь тона lit.\nКарточка: Fig 3, заголовок «Bytes per value», подсказка «depth = bytes», readout «1 → 8 B».\nДвижение и управление: фигура статичная.\nВывод: один отдельный .svg-файл со встроенными стилями (figureSvg({ standalone })), тема {theme}, плюс PNG-превью.\nПройди проверки скилла: audit и line check до нуля, 4× крупные планы всех стыков в обеих темах, телефон 390 px.",
  "variables": [
    {
      "name": "types",
      "label": "Типы и размеры",
      "default": "bool 1, int8 1, int16 2, float16 2, int32 4, float32 4, float64 8"
    },
    {
      "name": "theme",
      "label": "Тема",
      "default": "тёмная",
      "options": [
        "тёмная",
        "светлая"
      ]
    }
  ],
  "qualityChecklist": [
    "С первого взгляда читается как настоящий предмет, а не схема из коробок",
    "При 4× в каждой области есть настоящие детали, нет пустых граней",
    "Каждая линия заканчивается на детали, ничего не проходит сквозь другое",
    "Глубины ящиков строго пропорциональны байтам",
    "Ящики нарисованы в правильном порядке перекрытия"
  ],
  "createdAt": "2026-10-15"
}
