{
  "$schema": "../schema/prompt.schema.json",
  "id": "token-bucket",
  "title": "Token bucket: лимит запросов",
  "summary": "Ограничитель частоты как бункер-дозатор: жетоны капают с постоянной скоростью, каждый запрос забирает жетон, пустой бункер — отказ.",
  "format": "html",
  "size": "figure",
  "category": "Бэкенд",
  "tags": [
    "rate limiting",
    "алгоритм",
    "API",
    "интерактив"
  ],
  "animated": true,
  "prompt": "/anatomy Сделай фигуру размера Figure, которая объясняет алгоритм token bucket для ограничения частоты запросов к API.\n\nОбъект: настольный дозатор жетонов: прозрачный бункер на станине, сверху раздаточное колесо, которое с постоянным шагом роняет жетоны, снизу шлюз, через который запрос забирает один жетон; рядом лоток отказов. Не используй коробки и стрелки — только механизм.\nЧто движется и что это значит: колесо роняет жетоны со скоростью пополнения, уровень в бункере растёт до ёмкости, лишние скатываются в перелив; каждый запрос открывает шлюз и уносит жетон; при пустом бункере шлюз не открывается и запрос падает в лоток отказов.\nРеальные числа (readout, движение и подпись считаются из одной модели): ёмкость {capacity} жетонов, пополнение {rate} жетонов в секунду, один запрос = один жетон.\nДетали (40–80 штук): станина на ножках с винтами, шкала уровня с рисками на каждый жетон, бункер со стенками и фасками, раздаточное колесо с ячейками и осью, шестерня привода, шлюз с заслонкой и пружиной, лоток отказов, перелив, табличка с тремя линиями. Жетоны в бункере — единственная деталь тона lit.\nКарточка: Fig 1, заголовок «Token bucket», подсказка «Click to send requests», readout «14 / {capacity} tokens · 0 rejected».\nДвижение и управление: клик или пробел отправляет запрос, зажатая клавиша шлёт поток быстрее пополнения, чтобы было видно, как бункер пустеет; без касаний идёт тур со всплеском запросов; при reduced motion — неподвижная фигура.\nВывод: один standalone HTML-файл (framework-free, сборка через build.mjs), который открывается двойным кликом, тема {theme}.\nПройди проверки скилла: audit и line check до нуля, 4× крупные планы всех стыков в обеих темах, телефон 390 px.",
  "variables": [
    {
      "name": "capacity",
      "label": "Ёмкость",
      "default": "20",
      "hint": "Максимум жетонов в бункере"
    },
    {
      "name": "rate",
      "label": "Пополнение в секунду",
      "default": "5"
    },
    {
      "name": "theme",
      "label": "Тема",
      "default": "тёмная",
      "options": [
        "тёмная",
        "светлая"
      ]
    }
  ],
  "qualityChecklist": [
    "С первого взгляда читается как настоящий предмет, а не схема из коробок",
    "При 4× в каждой области есть настоящие детали, нет пустых граней",
    "Каждая линия заканчивается на детали, ничего не проходит сквозь другое",
    "Число жетонов в бункере совпадает с readout",
    "Отказ случается только при пустом бункере"
  ],
  "createdAt": "2026-10-15"
}
