{
  "$schema": "../schema/prompt.schema.json",
  "id": "thermostat-boiler",
  "title": "Термостат с гистерезисом",
  "summary": "Почему отопление не щёлкает каждую секунду: газовый котёл, биметаллический термостат и живое пламя горелки на WebGL.",
  "format": "webgl",
  "size": "figure",
  "category": "Физика",
  "tags": [
    "гистерезис",
    "огонь",
    "управление",
    "шейдер"
  ],
  "animated": true,
  "prompt": "/anatomy Сделай фигуру размера Figure, которая объясняет регулирование с гистерезисом: включение и выключение на двух разных порогах, чтобы система не дребезжала.\n\nОбъект: газовый котёл со снятой передней панелью и биметаллический термостат на стене, соединённые проводом; в топке видна горелка.\nЧто движется и что это значит: комната остывает, биметаллическая спираль закручивается и при {low} замыкает контакт — горелка разгорается (пламя на WebGL); температура растёт, при {high} спираль размыкает контакт, пламя гаснет. Между порогами состояние не меняется.\nРеальные числа (readout, движение и подпись считаются из одной модели): нижний порог {low}, верхний {high}, нагрев около 0.5 °C в минуту, остывание около 0.3 °C в минуту; на шкале термостата риска на каждые 0.5 °C.\nДетали (40–80 штук): корпус котла с фасками, топка с огнеупорной кладкой, горелка с рядом сопел, газовый клапан с катушкой, трубы подачи и обратки с фланцами, термостат: основание, шкала, биметаллическая спираль, контакт, ручка уставки с накаткой; провод с разъёмами. Пламя — единственный lit-элемент.\nКарточка: Fig 6, заголовок «Thermostat», подсказка «Drag the setpoint», readout «20.4 °C · burner on».\nДвижение и управление: перетаскивание ручки двигает оба порога; пламя разгорается и гаснет по огибающей без скачков; время ускорено и показано в readout; при reduced motion — один кадр.\nВывод: один standalone HTML-файл (framework-free) со слоями SVG + WebGL внутри рисунка, тема {theme}. Без WebGL фигура должна читаться как обычный SVG.\nПройди проверки скилла: audit и line check до нуля, 4× крупные планы всех стыков в обеих темах, телефон 390 px.",
  "variables": [
    {
      "name": "low",
      "label": "Нижний порог",
      "default": "19 °C"
    },
    {
      "name": "high",
      "label": "Верхний порог",
      "default": "21 °C"
    },
    {
      "name": "theme",
      "label": "Тема",
      "default": "тёмная",
      "options": [
        "тёмная",
        "светлая"
      ]
    }
  ],
  "qualityChecklist": [
    "С первого взгляда читается как настоящий предмет, а не схема из коробок",
    "При 4× в каждой области есть настоящие детали, нет пустых граней",
    "Каждая линия заканчивается на детали, ничего не проходит сквозь другое",
    "Пламя не мигает при пересечении порога — только огибающая",
    "В светлой теме пламя рисуется чернилами по бумаге, а не screen-смешением"
  ],
  "createdAt": "2026-10-15"
}
