{
  "$schema": "../schema/prompt.schema.json",
  "id": "separable-blur",
  "title": "Раздельное размытие",
  "summary": "Почему размытие 49×49 делают в два прохода: штамп из 2 401 гвоздя против двух гребёнок по 49 зубцов на рельсах.",
  "format": "svg",
  "size": "figure",
  "category": "Графика",
  "tags": [
    "GPU",
    "шейдер",
    "свёртка",
    "производительность"
  ],
  "animated": false,
  "prompt": "/anatomy Сделай фигуру размера Figure, которая объясняет раздельную свёртку: размытие {kernel}×{kernel} равно горизонтальному проходу и вертикальному, и выборок нужно в разы меньше.\n\nОбъект: слева — тяжёлый штамп «ложе гвоздей» с сеткой {kernel}×{kernel} гвоздей над листом; справа — две гребёнки на рельсах: горизонтальная и вертикальная, по {kernel} зубцов.\nЧто движется и что это значит: в кадре штамп поднят над листом, а гребёнки — посреди хода по своим рельсам; разница в числе зубцов видна сразу.\nРеальные числа (readout, движение и подпись считаются из одной модели): {kernel}×{kernel} выборок против {kernel} + {kernel}; приведи точные числа в readout.\nДетали (40–80 штук): общая плита на ножках, лист с полями, рама штампа с направляющими колоннами и пружинами, сетка гвоздей, рукоятка с накаткой, два рельса с упорами и линейками, каретки на втулках, гребёнки с зубцами, винты. Гребёнки — детали тона lit.\nКарточка: Fig 4, заголовок «Separable blur», подсказка «one stamp vs two combs», readout «2,401 vs 98 taps».\nДвижение и управление: фигура статичная.\nВывод: один отдельный .svg-файл со встроенными стилями (figureSvg({ standalone })), тема {theme}, плюс PNG-превью.\nПройди проверки скилла: audit и line check до нуля, 4× крупные планы всех стыков в обеих темах, телефон 390 px.",
  "variables": [
    {
      "name": "kernel",
      "label": "Размер ядра",
      "default": "49"
    },
    {
      "name": "theme",
      "label": "Тема",
      "default": "тёмная",
      "options": [
        "тёмная",
        "светлая"
      ]
    }
  ],
  "qualityChecklist": [
    "С первого взгляда читается как настоящий предмет, а не схема из коробок",
    "При 4× в каждой области есть настоящие детали, нет пустых граней",
    "Каждая линия заканчивается на детали, ничего не проходит сквозь другое",
    "Сетка гвоздей полная, ряды заканчиваются на раме",
    "Readout пересчитан под выбранное ядро"
  ],
  "createdAt": "2026-10-15"
}
