{
  "$schema": "../schema/prompt.schema.json",
  "id": "leaky-bucket",
  "title": "Leaky bucket: водяные часы",
  "summary": "Сглаживание всплесков трафика как клепсидра: вода льётся рывками, а вытекает ровно через калиброванное отверстие.",
  "format": "webgl",
  "size": "figure",
  "category": "Бэкенд",
  "tags": [
    "rate limiting",
    "очередь",
    "вода",
    "шейдер"
  ],
  "animated": true,
  "prompt": "/anatomy Сделай фигуру размера Figure, которая объясняет алгоритм leaky bucket: неровный входящий поток превращается в ровный исходящий, а переполнение отбрасывается.\n\nОбъект: водяные часы (клепсидра) на деревянной подставке: верхний сосуд с переливом, калиброванное отверстие, нижний мерный сосуд со шкалой.\nЧто движется и что это значит: запросы приходят всплесками и вливаются в верхний сосуд; вода вытекает через отверстие ровной струёй — это обработка; когда уровень доходит до перелива, лишняя вода уходит в сливной лоток — это отброшенные запросы. Вода, струя и блики — WebGL в плоскостях сосудов.\nРеальные числа (readout, движение и подпись считаются из одной модели): ёмкость {capacity} запросов, скорость обработки {rate} запросов в секунду, всплески по 5–15 запросов.\nДетали (40–80 штук): подставка с ножками и винтами, верхний сосуд со стенками и ободом, перелив с носиком, сливной лоток, калиброванная втулка отверстия, нижний сосуд со шкалой, поплавок со стрелкой, кран входа, табличка.\nКарточка: Fig 7, заголовок «Leaky bucket», подсказка «Click to pour a burst», readout «9 / {capacity} queued · {rate}/s out».\nДвижение и управление: клик вливает всплеск; струя на выходе всегда одна и та же; вода колышется по огибающей; при reduced motion — один кадр.\nВывод: один standalone HTML-файл (framework-free) со слоями SVG + WebGL внутри рисунка, тема {theme}. Без WebGL фигура должна читаться как обычный SVG.\nПройди проверки скилла: audit и line check до нуля, 4× крупные планы всех стыков в обеих темах, телефон 390 px.",
  "variables": [
    {
      "name": "capacity",
      "label": "Ёмкость",
      "default": "30"
    },
    {
      "name": "rate",
      "label": "Обработка в секунду",
      "default": "4"
    },
    {
      "name": "theme",
      "label": "Тема",
      "default": "тёмная",
      "options": [
        "тёмная",
        "светлая"
      ]
    }
  ],
  "qualityChecklist": [
    "С первого взгляда читается как настоящий предмет, а не схема из коробок",
    "При 4× в каждой области есть настоящие детали, нет пустых граней",
    "Каждая линия заканчивается на детали, ничего не проходит сквозь другое",
    "Вода в сосуде обрезана стенками и в своей плоскости, и проёмом",
    "Уровень и readout считаются из одной модели"
  ],
  "createdAt": "2026-10-15"
}
