{
  "$schema": "../schema/prompt.schema.json",
  "id": "turning-dial",
  "title": "Кодовый диск в 3D",
  "summary": "3D-режим anatomy: кодовый диск поворачивается по-настоящему, маленькая рука робота крутит его, LED и искры следуют за деталями.",
  "format": "webgl",
  "size": "hero",
  "category": "Механизмы",
  "tags": [
    "3D",
    "робот",
    "сейф",
    "шейдер",
    "интерактив"
  ],
  "animated": true,
  "prompt": "/anatomy Сделай фигуру размера Hero, которая объясняет как кодовый замок набирает комбинацию поворотами диска, — в 3D-режиме (beta).\n\nОбъект: кодовый диск сейфа с маленькой рукой робота на нём: пальцы на шарнирах, капсула на ладони.\nЧто движется и что это значит: диск поворачивается в настоящем 3D, рука следует за ним; трёхшарнирный палец поднимается; по клавише B капсула отламывается и падает как свободное тело; WebGL-светодиод, его световое пятно и искры следуют за движущимися деталями.\nРеальные числа (readout, движение и подпись считаются из одной модели): диск на 100 делений, комбинация {combination}; около 90 живых деталей в металлических материалах.\nДетали (80–150 штук): основание с винтами, кольцо шкалы с рисками, диск с накаткой, рука: запястье, ладонь, три пальца по три фаланги, шарниры-кнопки, кабели через зажимы, капсула со светодиодом.\nКарточка: Fig 5, заголовок «Turning dial», подсказка «Drag the dial · arrow keys · B breaks the pod», readout — текущее деление и набранные цифры.\nДвижение и управление: перетаскивание и стрелки вращают диск; шейдеры привязаны к группе через controller.anchor; проверь orbit audit (`turn audit passed`).\nВывод: один standalone HTML-файл (framework-free) со слоями SVG + WebGL внутри рисунка, тема {theme}. Без WebGL фигура должна читаться как обычный SVG.\nПройди проверки скилла: audit и line check до нуля, 4× крупные планы всех стыков в обеих темах, телефон 390 px.",
  "variables": [
    {
      "name": "combination",
      "label": "Комбинация",
      "default": "24 – 61 – 7"
    },
    {
      "name": "theme",
      "label": "Тема",
      "default": "тёмная",
      "options": [
        "тёмная",
        "светлая"
      ]
    }
  ],
  "qualityChecklist": [
    "С первого взгляда читается как настоящий предмет, а не схема из коробок",
    "При 4× в каждой области есть настоящие детали, нет пустых граней",
    "Каждая линия заканчивается на детали, ничего не проходит сквозь другое",
    "Порядок отрисовки верный на всех углах поворота",
    "Ни один живой кабель не пересекает два подвижных узла"
  ],
  "example": {
    "dark": "examples/turning-dial.html",
    "light": "examples/turning-dial-light.html"
  },
  "source": "anatomy/examples/turning-dial",
  "createdAt": "2026-10-15"
}
