{
  "$schema": "../schema/prompt.schema.json",
  "id": "arcade-cabinet",
  "title": "Аркадный автомат в разрезе",
  "summary": "Путь монеты: щель, монетоприёмник, контакт, импульс по кабелю к плате и прогрев ЭЛТ до attract-режима.",
  "format": "html",
  "size": "hero",
  "category": "Техника",
  "tags": [
    "ретро",
    "разрез",
    "монета",
    "электрика",
    "интерактив"
  ],
  "animated": true,
  "prompt": "/anatomy Сделай фигуру размера Hero, которая объясняет как одна монета будит аркадный автомат: от щели до самотеста платы и attract-режима.\n\nОбъект: вертикальный аркадный автомат 1981 года высотой 178 см со снятой левой боковой панелью, видны монетоприёмник, жёлоб, контакт монеты, денежный ящик, плата, монитор на боку.\nЧто движется и что это значит: монета (24.26 мм) проходит проверку механизма, катится по жёлобу 30° и падает 27 см мимо проволоки контакта в ящик; импульс контакта бежит по кабелю к плате, реле включает питание, ЭЛТ прогревается и запускает attract-режим. Джойстик замыкает микропереключатель под панелью.\nРеальные числа (readout, движение и подпись считаются из одной модели): монитор вертикальный, 224 × 288 пикселей, развёртка 15.734 кГц, прогрев нити около 2 с; скорость монеты на жёлобе — как у катящегося диска на уклоне 30°.\nДетали (80–150 штук): корпус с Т-кантом, маркиза с подсветкой, панель управления с джойстиком и кнопкой, монетная дверца с двумя щелями, механизм монетоприёмника, жёлоб, контакт, счётчик, денежный ящик, плата с микросхемами, жгут проводов с разъёмами, трансформатор, монитор с кинескопом, ножки. Монета — деталь тона lit.\nКарточка: Fig 3, заголовок «Upright cabinet, side off», подсказка «C or click the quarters · ← → · space», readout — состояние: off / warming / self-test / attract и число монет.\nДвижение и управление: клик по монетам или C бросает монету, стрелки двигают джойстик, пробел — кнопка огня, Escape выключает автомат; камера подобрана так, чтобы механизм в разрезе был виден.\nВывод: один standalone HTML-файл (framework-free, сборка через build.mjs), который открывается двойным кликом, тема {theme}.\nПройди проверки скилла: audit и line check до нуля, 4× крупные планы всех стыков в обеих темах, телефон 390 px.",
  "variables": [
    {
      "name": "theme",
      "label": "Тема",
      "default": "тёмная",
      "options": [
        "тёмная",
        "светлая"
      ]
    }
  ],
  "qualityChecklist": [
    "С первого взгляда читается как настоящий предмет, а не схема из коробок",
    "При 4× в каждой области есть настоящие детали, нет пустых граней",
    "Каждая линия заканчивается на детали, ничего не проходит сквозь другое",
    "Кабели идут вдоль конструкции и заканчиваются на разъёмах",
    "`node build.mjs --audit` заканчивается `audit passed`"
  ],
  "example": {
    "dark": "examples/arcade-cabinet.html",
    "light": "examples/arcade-cabinet-light.html"
  },
  "source": "anatomy/examples/arcade-cabinet",
  "createdAt": "2026-10-15"
}
