{
  "$schema": "../schema/prompt.schema.json",
  "id": "cache-key-lock",
  "title": "Ключ кэша как замок",
  "summary": "Мемоизация как цилиндровый замок: если все штифты совпали, цилиндр поворачивается и работа не повторяется.",
  "format": "svg",
  "size": "figure",
  "category": "Фронтенд",
  "tags": [
    "кэш",
    "мемоизация",
    "React",
    "статья"
  ],
  "animated": false,
  "prompt": "/anatomy Сделай фигуру размера Figure, которая объясняет ключ кэша (мемоизацию): работа пропускается, только если совпала каждая часть ключа.\n\nОбъект: цилиндровый замок в разрезе на подставке, ключ вставлен; каждый штифт — одна зависимость из ключа: {deps}.\nЧто движется и что это значит: в кадре все штифты стоят ровно по линии разъёма, цилиндр повёрнут — это попадание в кэш; рядом второй замок, где один штифт выше линии — изменилась зависимость, цилиндр заблокирован, нужен пересчёт.\nРеальные числа (readout, движение и подпись считаются из одной модели): по одному штифту на зависимость, высоты штифтов соответствуют значениям; линия разъёма — одна прямая.\nДетали (40–80 штук): две подставки с винтами, корпуса замков в разрезе с фасками, цилиндры, пары штифтов с пружинками, линия разъёма, ключи с бородками, гравировка на ключе (одна крошечная надпись), табличка. Штифт, который не совпал, — единственная деталь тона lit.\nКарточка: Fig 2, заголовок «Cache key», подсказка «every pin must match», readout «hit · miss».\nДвижение и управление: фигура статичная.\nВывод: один отдельный .svg-файл со встроенными стилями (figureSvg({ standalone })), тема {theme}, плюс PNG-превью.\nПройди проверки скилла: audit и line check до нуля, 4× крупные планы всех стыков в обеих темах, телефон 390 px.",
  "variables": [
    {
      "name": "deps",
      "label": "Зависимости ключа",
      "default": "props.id, theme, locale, version"
    },
    {
      "name": "theme",
      "label": "Тема",
      "default": "тёмная",
      "options": [
        "тёмная",
        "светлая"
      ]
    }
  ],
  "qualityChecklist": [
    "С первого взгляда читается как настоящий предмет, а не схема из коробок",
    "При 4× в каждой области есть настоящие детали, нет пустых граней",
    "Каждая линия заканчивается на детали, ничего не проходит сквозь другое",
    "Пружины разделены на задние и передние половины вокруг штифтов",
    "Число штифтов равно числу зависимостей"
  ],
  "createdAt": "2026-10-15"
}
