{
  "$schema": "../schema/prompt.schema.json",
  "id": "round-robin-distributor",
  "title": "Round-robin балансировщик",
  "summary": "Балансировка по кругу как распределитель зажигания: бегунок по очереди касается контакта каждого сервера.",
  "format": "svg",
  "size": "figure",
  "category": "Бэкенд",
  "tags": [
    "балансировка",
    "нагрузка",
    "инфраструктура",
    "лендинг"
  ],
  "animated": false,
  "prompt": "/anatomy Сделай фигуру размера Figure, которая объясняет балансировку нагрузки round-robin: запросы раздаются серверам строго по очереди.\n\nОбъект: распределитель зажигания со снятой крышкой: бегунок на валу, {servers} контактов по кругу, от каждого контакта — высоковольтный провод к своей «свече»-серверу в ряд на стойке.\nЧто движется и что это значит: в кадре бегунок стоит напротив одного контакта — этот сервер получает текущий запрос; искровой зазор подсвечен.\nРеальные числа (readout, движение и подпись считаются из одной модели): {servers} серверов, каждый получает 1/{servers} запросов; угол между контактами 360°/{servers}.\nДетали (40–80 штук): корпус распределителя с фланцем и винтами, крышка рядом с клеммами, вал с шестернёй, бегунок, кольцо контактов, провода в изоляции с наконечниками и зажимами, стойка серверов-свечей с номерными табличками, основание на ножках. Активный контакт — единственная деталь тона lit.\nКарточка: Fig 5, заголовок «Round robin», подсказка «one turn = one round», readout «server 3 / {servers}».\nДвижение и управление: фигура статичная.\nВывод: один отдельный .svg-файл со встроенными стилями (figureSvg({ standalone })), тема {theme}, плюс PNG-превью.\nПройди проверки скилла: audit и line check до нуля, 4× крупные планы всех стыков в обеих темах, телефон 390 px.",
  "variables": [
    {
      "name": "servers",
      "label": "Число серверов",
      "default": "6"
    },
    {
      "name": "theme",
      "label": "Тема",
      "default": "тёмная",
      "options": [
        "тёмная",
        "светлая"
      ]
    }
  ],
  "qualityChecklist": [
    "С первого взгляда читается как настоящий предмет, а не схема из коробок",
    "При 4× в каждой области есть настоящие детали, нет пустых граней",
    "Каждая линия заканчивается на детали, ничего не проходит сквозь другое",
    "Провода не пересекают корпус и сходятся только на клеммах",
    "Контакты равномерно распределены по кругу"
  ],
  "createdAt": "2026-10-15"
}
