{
  "$schema": "../schema/prompt.schema.json",
  "id": "raptor-engine",
  "title": "Ракетный двигатель на стенде",
  "summary": "Полнопоточная ступенчатая схема Raptor 2: два преднагнетателя, два насоса, огонь, ударные волны и разборка на 11 узлов.",
  "format": "webgl",
  "size": "hero",
  "category": "Инженерия",
  "tags": [
    "ракета",
    "огонь",
    "шейдер",
    "разборка",
    "трубопроводы"
  ],
  "animated": true,
  "prompt": "/anatomy Сделай фигуру размера Hero, которая объясняет полнопоточную ступенчатую схему сгорания на примере Raptor 2.\n\nОбъект: двигатель, подвешенный в испытательном стенде, с датчиком тяги над карданом, плотной обвязкой труб и жгутов.\nЧто движется и что это значит: кислород целиком идёт через окислительный преднагнетатель, который крутит кислородный насос; метан целиком — через топливный преднагнетатель, который крутит метановый насос; горячие газы встречаются в основной камере. При запуске — факел, ударные диски, брызги и пар; по команде двигатель разлетается на 11 узлов с пружинной задержкой.\nРеальные числа (readout, движение и подпись считаются из одной модели): кислород и метан, соотношение 3.6, давление в камере 300 бар, тяга 230 тс на уровне моря, сухая масса 1 630 кг.\nДетали (80–150 штук): рама стенда, датчик тяги, кардан, сопло с поясами охлаждения, камера, два насоса, два преднагнетателя, магистрали с фланцами и хомутами, клапаны, сильфоны, жгуты в оплётке с разъёмами. Круглые детали — kit/lathe.mjs, трубы — kit/tube.mjs.\nКарточка: Fig 4, заголовок «Raptor 2», readout «1,630 kg · cold» → тяга при работе.\nДвижение и управление: кнопки запуска и разборки; все uniform-ы шейдера идут через огибающие, без скачков; при reduced motion — один кадр.\nВывод: один standalone HTML-файл (framework-free) со слоями SVG + WebGL внутри рисунка, тема {theme}. Без WebGL фигура должна читаться как обычный SVG.\nПройди проверки скилла: audit и line check до нуля, 4× крупные планы всех стыков в обеих темах, телефон 390 px.",
  "variables": [
    {
      "name": "theme",
      "label": "Тема",
      "default": "тёмная",
      "options": [
        "тёмная",
        "светлая"
      ]
    }
  ],
  "qualityChecklist": [
    "С первого взгляда читается как настоящий предмет, а не схема из коробок",
    "При 4× в каждой области есть настоящие детали, нет пустых граней",
    "Каждая линия заканчивается на детали, ничего не проходит сквозь другое",
    "Факел живёт в мировом пространстве и не обрезается краем холста",
    "Нет скачков цвета между фазами: контакт-лист со slow 0.05",
    "audit проходит в покое, в разборке и в каждом кадре"
  ],
  "example": {
    "dark": "examples/raptor-engine.html",
    "light": "examples/raptor-engine-light.html"
  },
  "source": "anatomy/examples/raptor-engine",
  "createdAt": "2026-10-15"
}
