{
  "$schema": "../schema/prompt.schema.json",
  "id": "cdn-edge-cache",
  "title": "CDN: попадание и промах",
  "summary": "Кэш на краю сети как стеллаж ячеек с таймерами: попадание выдаётся сразу, промах едет за оригиналом, TTL отмеряют песочные часы.",
  "format": "svg",
  "size": "figure",
  "category": "Веб",
  "tags": [
    "кэш",
    "CDN",
    "TTL",
    "лендинг"
  ],
  "animated": false,
  "prompt": "/anatomy Сделай фигуру размера Figure, которая объясняет как работает кэш на краю CDN: попадание, промах и истечение TTL.\n\nОбъект: стойка выдачи на почте: стеллаж ячеек с песочными часами на каждой; рядом пневмопочта к далёкому складу (origin).\nЧто движется и что это значит: в статичном кадре показан момент: одна ячейка выдаёт копию сразу (попадание), у второй часы истекли, и капсула пневмопочты уходит к складу за свежей копией (промах).\nРеальные числа (readout, движение и подпись считаются из одной модели): TTL {ttl} секунд; в стеллаже 12 ячеек, 9 заполнены, у одной часы на нуле.\nДетали (40–80 штук): основание стойки на ножках, стеллаж с перегородками и номерными табличками, ячейки с карточками, песочные часы в оправах, конторка, пневмотруба с хомутами и муфтами, капсула, станция приёма, табличка. Капсула — единственная деталь тона lit.\nКарточка: Fig 1, заголовок «Edge cache», подсказка «hit · miss · TTL {ttl}s», readout «9 / 12 fresh».\nДвижение и управление: фигура статичная; подсказка и readout — пояснения к кадру.\nВывод: один отдельный .svg-файл со встроенными стилями (figureSvg({ standalone })), тема {theme}, плюс PNG-превью.\nПройди проверки скилла: audit и line check до нуля, 4× крупные планы всех стыков в обеих темах, телефон 390 px.",
  "variables": [
    {
      "name": "ttl",
      "label": "TTL, секунд",
      "default": "60"
    },
    {
      "name": "theme",
      "label": "Тема",
      "default": "тёмная",
      "options": [
        "тёмная",
        "светлая"
      ]
    }
  ],
  "qualityChecklist": [
    "С первого взгляда читается как настоящий предмет, а не схема из коробок",
    "При 4× в каждой области есть настоящие детали, нет пустых граней",
    "Каждая линия заканчивается на детали, ничего не проходит сквозь другое",
    "Пневмотруба разорвана под каждым хомутом и заканчивается на станции",
    "Монохром с одним акцентом, без надписей в воздухе"
  ],
  "createdAt": "2026-10-15"
}
