{
  "$schema": "../schema/prompt.schema.json",
  "id": "desk-computer",
  "title": "Настольный компьютер 1984",
  "summary": "Клавиатура и ЭЛТ: нажатая клавиша опускается, символ появляется на экране, при выключении картинка схлопывается в линию и точку.",
  "format": "html",
  "size": "figure",
  "category": "Техника",
  "tags": [
    "ретро",
    "ЭЛТ",
    "клавиатура",
    "интерактив"
  ],
  "animated": true,
  "prompt": "/anatomy Сделай фигуру размера Figure, которая объясняет путь символа от нажатия клавиши до строки на экране ЭЛТ и то, как гаснет кинескоп.\n\nОбъект: моноблочный компьютер в духе 1984 года: ЭЛТ в высоком корпусе, щель дисковода и решётка динамика под ним, вентиляционные прорези и клавишный выключатель сбоку, отдельная клавиатура.\nЧто движется и что это значит: при вводе текста нажатая клавиша опускается, а символ ложится в строку на экране под надписью «{screenMark}». Escape или клик по корпусу выключает питание: изображение сжимается в линию, затем в точку.\nРеальные числа (readout, движение и подпись считаются из одной модели): раскладка QWERTY с реальными рядами клавиш; строка на экране вмещает самую длинную вводимую строку и обрезается окном экрана; схлопывание ЭЛТ длится около 0.4 с.\nДетали (40–80 штук): корпус с фаской и швами, рамка кинескопа, экран в плоскости передней грани, щель дисковода с шторкой, решётка динамика, прорези вентиляции, выключатель, ножки, клавиатура с отдельными клавишами, кабель клавиатуры с разъёмом. Экран — единственная деталь тона lit.\nКарточка: Fig 2, заголовок «Desk computer», подсказка «Type on it · click it to switch», readout — число введённых символов.\nДвижение и управление: фокус на фигуре, затем ввод с клавиатуры; Backspace и Return работают; без ввода курсор мигает; при reduced motion нет анимации схлопывания.\nВывод: один standalone HTML-файл (framework-free, сборка через build.mjs), который открывается двойным кликом, тема {theme}.\nПройди проверки скилла: audit и line check до нуля, 4× крупные планы всех стыков в обеих темах, телефон 390 px.",
  "variables": [
    {
      "name": "screenMark",
      "label": "Надпись на экране",
      "default": "Anthropic",
      "hint": "Короткий логотип или слово"
    },
    {
      "name": "theme",
      "label": "Тема",
      "default": "тёмная",
      "options": [
        "тёмная",
        "светлая"
      ]
    }
  ],
  "qualityChecklist": [
    "С первого взгляда читается как настоящий предмет, а не схема из коробок",
    "При 4× в каждой области есть настоящие детали, нет пустых граней",
    "Каждая линия заканчивается на детали, ничего не проходит сквозь другое",
    "Текст на экране лежит в плоскости передней грани и обрезан окном",
    "Каждая клавиша — отдельное тело с фаской"
  ],
  "example": {
    "dark": "examples/desk-computer.html",
    "light": "examples/desk-computer-light.html"
  },
  "source": "anatomy/examples/desk-computer",
  "createdAt": "2026-10-15"
}
