{
  "$schema": "../schema/prompt.schema.json",
  "id": "dial-indicator",
  "title": "Индикатор часового типа",
  "summary": "Как стрелка усиливает крошечное перемещение: индикатор на стойке над поверочной плитой, каретка ездит над блоками разной высоты.",
  "format": "html",
  "size": "figure",
  "category": "Измерения",
  "tags": [
    "прибор",
    "точность",
    "стрелка",
    "интерактив"
  ],
  "animated": true,
  "prompt": "/anatomy Сделай фигуру размера Figure, которая объясняет как индикатор часового типа превращает малое линейное перемещение плунжера в большой поворот стрелки.\n\nОбъект: индикатор часового типа на стойке, каретка на рельсе над поверочной плитой, под ней ряд мерных блоков.\nЧто движется и что это значит: каретка переезжает с блока на блок, плунжер поднимается или опускается на блок, стрелка поворачивается — угол стрелки и есть высота блока.\nРеальные числа (readout, движение и подпись считаются из одной модели): блоки высотой {blocks} px; один оборот стрелки = 20 px хода плунжера; шкала на 100 делений.\nДетали (40–80 штук): плита на ножках с канавкой и винтами по углам, линейка с рисками, стойка с зажимом, рельс с упорами, каретка на втулках, плунжер с наконечником, циферблат с радиальными рисками и малым счётчиком оборотов, накатанная головка, мерные блоки с фасками. Стрелка — единственная деталь тона lit.\nКарточка: Fig 1, заголовок «Dial indicator», подсказка «Hover to slide the carriage», readout «block 1 · reads 18.0 px».\nДвижение и управление: наведение двигает каретку, стрелки клавиатуры переводят с блока на блок, стрелка догоняет показание экспоненциально; без касаний идёт тихий тур по блокам, при reduced motion фигура неподвижна.\nВывод: один standalone HTML-файл (framework-free, сборка через build.mjs), который открывается двойным кликом, тема {theme}.\nПройди проверки скилла: audit и line check до нуля, 4× крупные планы всех стыков в обеих темах, телефон 390 px.",
  "variables": [
    {
      "name": "blocks",
      "label": "Высоты блоков",
      "default": "18, 14 и 10",
      "hint": "Через запятую, в px мира"
    },
    {
      "name": "theme",
      "label": "Тема",
      "default": "тёмная",
      "options": [
        "тёмная",
        "светлая"
      ]
    }
  ],
  "qualityChecklist": [
    "С первого взгляда читается как настоящий предмет, а не схема из коробок",
    "При 4× в каждой области есть настоящие детали, нет пустых граней",
    "Каждая линия заканчивается на детали, ничего не проходит сквозь другое",
    "Показание readout совпадает с углом стрелки на каждом блоке",
    "Риски циферблата не обрываются посреди грани"
  ],
  "example": {
    "dark": "examples/dial-indicator.html",
    "light": "examples/dial-indicator-light.html"
  },
  "source": "anatomy/examples/dial-indicator",
  "createdAt": "2026-10-15"
}
