{
  "$schema": "../schema/prompt.schema.json",
  "id": "ripple-tank",
  "title": "Волновая ванна",
  "summary": "Интерференция двух источников: школьная волновая ванна, стробоскоп, каустики на бумаге и узловые линии из настоящей дисперсии.",
  "format": "webgl",
  "size": "hero",
  "category": "Физика",
  "tags": [
    "волны",
    "вода",
    "свет",
    "каустики",
    "шейдер"
  ],
  "animated": true,
  "prompt": "/anatomy Сделай фигуру размера Hero, которая объясняет интерференцию волн от двух источников и то, почему появляются узловые линии.\n\nОбъект: школьная волновая ванна на высоких ножках над бумажным экраном, лампа сверху, два вибратора на одной штанге, вид сверху под 44°.\nЧто движется и что это значит: вибраторы касаются воды в фазе, волны расходятся, где пути различаются на полволны — гасят друг друга; лампа стробирует чуть медленнее частоты, и волны честно ползут в замедлении. Каустики и тени на бумаге — WebGL, привязанный к изометрическим плоскостям.\nРеальные числа (readout, движение и подпись считаются из одной модели): глубина воды 6 мм, частота 16–28 Гц, дисперсия ω² = (gk + σk³/ρ) tanh kh, расстояние между вибраторами около 5 см, узловых линий 2⌊d/λ + ½⌋.\nДетали (80–150 штук): ванна со стеклянным дном и рамой, ножки с регулировкой, бумажный экран, лампа на штативе с кабелем, штанга вибраторов, мотор с эксцентриком, пенный пляж по краям, ручки частоты и расстояния со шкалами.\nКарточка: Fig 3, заголовок «Ripple tank», подсказка «Move across for f · up and down for spacing», readout — частота, длина волны, число узловых линий.\nДвижение и управление: движение указателя по горизонтали меняет частоту, по вертикали — расстояние; изменение бежит от вибраторов через текстуру истории; при reduced motion — один кадр.\nВывод: один standalone HTML-файл (framework-free) со слоями SVG + WebGL внутри рисунка, тема {theme}. Без WebGL фигура должна читаться как обычный SVG.\nПройди проверки скилла: audit и line check до нуля, 4× крупные планы всех стыков в обеих темах, телефон 390 px.",
  "variables": [
    {
      "name": "theme",
      "label": "Тема",
      "default": "тёмная",
      "options": [
        "тёмная",
        "светлая"
      ]
    }
  ],
  "qualityChecklist": [
    "С первого взгляда читается как настоящий предмет, а не схема из коробок",
    "При 4× в каждой области есть настоящие детали, нет пустых граней",
    "Каждая линия заканчивается на детали, ничего не проходит сквозь другое",
    "Каустики точно совпадают с плоскостью бумаги",
    "Число узловых линий совпадает с формулой в readout"
  ],
  "example": {
    "dark": "examples/ripple-tank.html",
    "light": "examples/ripple-tank-light.html"
  },
  "source": "anatomy/examples/ripple-tank",
  "createdAt": "2026-10-15"
}
