{
  "$schema": "../schema/prompt.schema.json",
  "id": "connection-pool",
  "title": "Пул соединений к базе",
  "summary": "Пул соединений как телефонный коммутатор: N шнуров, запросы занимают шнур и возвращают его, лишние ждут в очереди лампочек.",
  "format": "html",
  "size": "figure",
  "category": "Бэкенд",
  "tags": [
    "база данных",
    "очередь",
    "конкурентность",
    "интерактив"
  ],
  "animated": true,
  "prompt": "/anatomy Сделай фигуру размера Figure, которая объясняет пул соединений к базе данных: запрос берёт свободное соединение, работает и возвращает его, а когда все заняты — ждёт в очереди.\n\nОбъект: ручной телефонный коммутатор: панель гнёзд, ряд из {poolSize} шнуров с противовесами, ряд ламп вызова, которые ждут свободного шнура.\nЧто движется и что это значит: новый запрос зажигает лампу вызова; если есть свободный шнур, он вытягивается и втыкается в гнездо базы; после работы шнур втягивается противовесом обратно; когда все шнуры заняты, лампы копятся в очереди и гаснут по одной по мере освобождения.\nРеальные числа (readout, движение и подпись считаются из одной модели): размер пула {poolSize}, среднее время запроса {queryMs} мс, очередь FIFO.\nДетали (40–80 штук): стол коммутатора на ножках, наклонная панель с гнёздами и номерными табличками, шнуры с вилками и противовесами под столом, ключи разговора, лампы вызова в оправах, гнездо базы данных, кабельный жгут к стене, винты по углам панелей. Занятый шнур — деталь тона lit.\nКарточка: Fig 2, заголовок «Connection pool», подсказка «Click to send queries», readout «7 / {poolSize} busy · 3 waiting».\nДвижение и управление: клик отправляет запрос, зажатие — поток; шнуры тянутся пружинно; без касаний идёт тур с пиком нагрузки; при reduced motion — неподвижная фигура.\nВывод: один standalone HTML-файл (framework-free, сборка через build.mjs), который открывается двойным кликом, тема {theme}.\nПройди проверки скилла: audit и line check до нуля, 4× крупные планы всех стыков в обеих темах, телефон 390 px.",
  "variables": [
    {
      "name": "poolSize",
      "label": "Размер пула",
      "default": "10"
    },
    {
      "name": "queryMs",
      "label": "Время запроса, мс",
      "default": "120"
    },
    {
      "name": "theme",
      "label": "Тема",
      "default": "тёмная",
      "options": [
        "тёмная",
        "светлая"
      ]
    }
  ],
  "qualityChecklist": [
    "С первого взгляда читается как настоящий предмет, а не схема из коробок",
    "При 4× в каждой области есть настоящие детали, нет пустых граней",
    "Каждая линия заканчивается на детали, ничего не проходит сквозь другое",
    "Шнуры не проходят сквозь панель и друг друга",
    "Очередь видна и считается так же, как в readout"
  ],
  "createdAt": "2026-10-15"
}
